video_url,title,collected_at
/watch?v=CwR2Brlj9k8&pp=ygUPc3Vid2F5IE5ldyBZb3Jr,"New York City Subway, Complete Guide, Do's and Don'ts (Explained and Tips from a Local)",2026-01-18 04:06:45.640935
/watch?v=fgTKTs33NLY&pp=ygUPc3Vid2F5IE5ldyBZb3Jr,How the NYC Subway Works,2026-01-18 04:06:45.641180
/watch?v=Q5pfKsBfzCI&pp=ygUPc3Vid2F5IE5ldyBZb3Jr,The Greatest Subway System in the World? | New York City Subway,2026-01-18 04:06:45.641403
/watch?v=VGy65I_9pDw&pp=ygUPc3Vid2F5IE5ldyBZb3Jr,Can $68BN Save New York’s Subway?,2026-01-18 04:06:45.641665
/watch?v=lutQ6koALFw&pp=ygUPc3Vid2F5IE5ldyBZb3Jr,🇺🇸 New York City Subway | All the Lines,2026-01-18 04:06:45.641901
/watch?v=jRjcoBgRWfI&pp=ygUPc3Vid2F5IE5ldyBZb3Jr0gcJCU8KAYcqIYzv,HOW to use the NYC Subway (Everything YOU NEED to know)!,2026-01-18 04:06:45.642059
/watch?v=0UZ9QXPfNwE&pp=ygUPc3Vid2F5IE5ldyBZb3Jr,[4K] 🇺🇸 New York City Subway | All the Lines (V2),2026-01-18 04:06:45.642205
/watch?v=5m6w1Pq0Pyw&pp=ygUPc3Vid2F5IE5ldyBZb3Jr,Architect Breaks Down NYC Subway Stations (Oldest & Newest) | Architectural Digest,2026-01-18 04:06:45.642348
/shorts/AcmcXLihbTQ,New York ain't normal 😳,2026-01-18 04:06:45.642491
/watch?v=9fL5etTRZzU&pp=ygUPc3Vid2F5IE5ldyBZb3Jr0gcJCU8KAYcqIYzv,How to Ride the New York City Subway (Guide to the NYC Subway),2026-01-18 04:06:45.642661
/watch?v=5dEhAd0yM70&pp=ygUPc3Vid2F5IE5ldyBZb3Jr,The Battle for New York's Subway,2026-01-18 04:06:45.642806
/watch?v=ukOHqdPbYYg&pp=ygUPc3Vid2F5IE5ldyBZb3Jr,⁴ᴷ⁶⁰ NYC Subway Front Window View - The 7 Express to Manhattan!,2026-01-18 04:06:45.642966
/watch?v=pphgq49lslI&pp=ygUPc3Vid2F5IE5ldyBZb3Jr0gcJCU8KAYcqIYzv,⁴ᴷ⁶⁰ NYC Subway Front Window View - The A Line to 207th Street,2026-01-18 04:06:45.643109
/watch?v=voc1qIS3pFU&pp=ygUPc3Vid2F5IE5ldyBZb3Jr,Why Queens still has a Subway Problem,2026-01-18 04:06:45.643254
/shorts/KqIqhDLKdDw,Welcome to the New York Subway #shorts #newyork,2026-01-18 04:06:45.643398
/shorts/WlU_VE78gfA,"To truly love New York, you must hate New York!! #nyc #subwaytakes",2026-01-18 04:06:45.643566
/shorts/05vLI6KrYAk,It’s the NYC Subway 😳,2026-01-18 04:06:45.643713
/watch?v=Qzdy50tfqmE&pp=ygUPc3Vid2F5IE5ldyBZb3Jr,NYC Subway Survival Guide (Watch Before You Go!),2026-01-18 04:06:45.643869
/watch?v=qAF971SUZEM&pp=ygUPc3Vid2F5IE5ldyBZb3Jr,Navigating the NYC Subway,2026-01-18 04:06:45.644013
/watch?v=F-V1oTJEGQ0&pp=ygUPc3Vid2F5IE5ldyBZb3Jr,"MTA New York City Subway A, C, E, L, Q, W Trains In Manhattan (1/4/21)",2026-01-18 04:06:45.644155
/shorts/lzUVIbh25lM,NYC Chivalry Ruined #shorts,2026-01-18 04:06:45.644299
/shorts/op8_A-t7aOc,Subway People Aren't Real,2026-01-18 04:06:45.644437
/watch?v=lfCzZconie8&pp=ygUPc3Vid2F5IE5ldyBZb3Jr,The hidden subway that New York refuses to build,2026-01-18 04:06:45.644616
/shorts/33KEM41hanQ,NYC’s subway is THE BEST in the world 😂😂 #newyorkcity,2026-01-18 04:06:45.644755
/watch?v=qj0MzKULyMo&pp=ygUPc3Vid2F5IE5ldyBZb3Jr,The World’s Worst Metro (NYC Subway),2026-01-18 04:06:45.644923
/shorts/Tq2TlEwQkxM,How to See an Abandoned NYC Subway Station,2026-01-18 04:06:45.645071
/watch?v=Hj_wI3_7w_g&pp=ygUPc3Vid2F5IE5ldyBZb3Jr,NEW YORK SUBWAY EXPLAINED | NYC Guide from a LOCAL,2026-01-18 04:06:45.645217
/watch?v=luvAouodeTY&pp=ygUPc3Vid2F5IE5ldyBZb3Jr0gcJCU8KAYcqIYzv,Ride the NYC Subway like a pro (tips from a local),2026-01-18 04:06:45.645360
/watch?v=Db2DBYCegK0&pp=ygUPc3Vid2F5IE5ldyBZb3Jr,Inside New York's BEST Subway Stations!,2026-01-18 04:06:45.645503
/watch?v=DBVDQY8Gygc&pp=ygUPc3Vid2F5IE5ldyBZb3Jr,How the NYC Subway Has Been Running for Over 120 Years | The Extra Mile,2026-01-18 04:06:45.645674
/watch?v=HeKFI-uhdcA&pp=ygUPc3Vid2F5IE5ldyBZb3Jr,An N.Y.C. Subway Operator’s Nightmare: Hitting a Person | The New Yorker Documentary,2026-01-18 04:06:45.645817
/watch?v=3aTxg5O6VGA&pp=ygUPc3Vid2F5IE5ldyBZb3Jr,BIZARRE 2AM NYC SUBWAY Walk 4K (West 4th Street Station) December 2021 🇺🇸,2026-01-18 04:06:45.645972
/shorts/u3hT_0hiURc,The New York subway is crazy,2026-01-18 04:06:45.646113
/watch?v=MtlZUWoFUdc&pp=ygUPc3Vid2F5IE5ldyBZb3Jr,The Don'ts of the New York Subway,2026-01-18 04:06:45.646259
/shorts/1BaAJY6Bn5Y,NYC Subway Guide (Easy Breezy Basics),2026-01-18 04:06:45.646405
/shorts/9bq4v9es6Wg,😱 Crazy NYC Subway #insane #crazy #funny #viralvideo #shorts,2026-01-18 04:06:45.646575
/watch?v=cVBhvKxw4ow&t=133s&pp=ygUPc3Vid2F5IE5ldyBZb3Jr,The Race to Construct the First Subway | The Engineering that Built the World (S1) | History,2026-01-18 04:06:45.646741
/shorts/gZn5PA-ZQik,Avoid This on the NYC Subway,2026-01-18 04:06:45.646882
/shorts/8wceQ0yxZoY,Why does the NYC Subway have both Letter and Number train lines? (with @newyorktransitmuseum),2026-01-18 04:06:45.647016
/watch?v=nXd7km8ngk8&pp=ygUPc3Vid2F5IE5ldyBZb3Jr,The New York City Subway: An Express History Tour,2026-01-18 04:06:45.647156
/watch?v=qvZJ2Fsngig&pp=ygUPc3Vid2F5IE5ldyBZb3Jr,We Tried Visiting 472 NYC Subway Stations in 22 Hours (World Record Attempt),2026-01-18 04:06:45.647296
/shorts/XQdNWpOPPHY,THERE WASN”T NO NAPKINS IN THE TRAIN SO…🚊🤷🏾‍♂️ #shorts #shortvideo #nyc #reels,2026-01-18 04:06:45.647437
/shorts/F8_DW1Px2cA,New York subway be like #nyc,2026-01-18 04:06:45.647595
/watch?v=QVw-g-Trb9M&pp=ygUPc3Vid2F5IE5ldyBZb3Jr,Why NYC’s Subway Keeps Flooding | WSJ Pro Perfected,2026-01-18 04:06:45.647736
/shorts/IGqm0cL3Ajo,The NYC Subway's Underground Museum #shorts #nytm,2026-01-18 04:06:45.647892
/watch?v=_I3tIwj5RK0&pp=ygUPc3Vid2F5IE5ldyBZb3Jr,New York Subway Operator Life 1980s vs 90s vs Today | Experts by Decade | Daily Mail,2026-01-18 04:06:45.648040
/shorts/ttxNBZb6NgI,WATCH: Kitten casually boards NYC subway car #shorts #viral #cat #subway #nyc #newyork #cute,2026-01-18 04:06:45.648175
/shorts/M27ph9iAOi0,Buying a Piece of the NYC Subway,2026-01-18 04:06:45.648317
/shorts/1I6d3kOTXBA,The Insane New York Subway's in 1980 #shorts,2026-01-18 04:06:45.648461
/shorts/q4VXuu-r4jY,That's enough New York Subway for one day 😳,2026-01-18 04:06:45.648631
/shorts/rvyotw7usKg,NYC Subway Fun Facts - Part 2 #shorts,2026-01-18 04:06:45.648773
/shorts/s8Mee28K-50,Dining on a SUBWAY?! Only in New York!,2026-01-18 04:06:45.648930
/shorts/x-3UxL8feBQ,Only In NYC ​⁠#youtubeshorts #funny #nyclife #dupreegod  #nyc #manhattan #brooklyn,2026-01-18 04:06:45.649078
/shorts/EGv4aJBq4Aw,4 Train Passing 5 Train at 96th Street Station #nyc #newyork #subway #mta #train #railway #nycsubway,2026-01-18 04:06:45.649222
/shorts/pRBJ_DI1uDc,NYC woman's hilarious reaction on realizing subway surfer had just climbed on top of train 🤣,2026-01-18 04:06:45.649367
/shorts/lF_-_gT88C4,This is the SLOWEST NYC Subway Train??? #nycsubway,2026-01-18 04:06:45.649556
/shorts/slvQj6sQox4,Average day on the NYC Subway #spiderman #shorts,2026-01-18 04:06:45.649709
/shorts/kKN_V2Cb88w,Woman dies after being set on fire on subway in New York,2026-01-18 04:06:45.649853
/shorts/CJbvefXoUOA,How do blind people use the NYC subway? #shorts,2026-01-18 04:06:45.650157
/shorts/PzvYNoJf6H8,The Museum that has the NYC Subway Cars through History (@newyorktransitmuseum),2026-01-18 04:06:45.650307
/watch?v=zuHib9ADwgA&list=RDzuHib9ADwgA&start_radio=1&pp=ygUPc3Vid2F5IE5ldyBZb3JroAcB0gcJCU8KAYcqIYzv,NY Subway for Kids | New York City Subway Song  by Thomas and Friends MTA Song,2026-01-18 04:06:45.650450
/shorts/V49TguyEkNI,Original World Trade Center door in a NYC subway station,2026-01-18 04:06:45.650610
/shorts/xFbAjbx1sec,Everybody in New York has rich parents or is selling drugs 😂😂😂  Agree or disagree? #subwaytakes,2026-01-18 04:06:45.650755
/watch?v=Db2DBYCegK0&pp=ygUPc3Vid2F5IE5ldyBZb3Jr0gcJCU8KAYcqIYzv,Inside New York's BEST Subway Stations!,2026-01-18 04:06:45.650914
/shorts/Q7_pxpkqhlc,MTA sealed off the entrance to the secret subway tracks in the Canal Street station in New York City,2026-01-18 04:06:45.651198
/shorts/XFcpniL6jjI,Why the NYC Subway is Broken 🚊,2026-01-18 04:06:45.651333
/shorts/vLNwGdqsZms,Standard day on the NYC subway. 🍕🐀#nycsubway #newyork #subway #fyp #foryoupage #shorts,2026-01-18 04:06:45.651468
/shorts/KmYqY5zxrKY,NYC Subway Safety Tips for Solo Travel,2026-01-18 04:06:45.651635
/shorts/dTUwlNqtLYI,Day 1 2025 - police officer lets me through the subway gate. #newyorkcity #2025 #subway,2026-01-18 04:06:45.651772
/shorts/3jLppgqrlXE,Only Cowards Believe in Peace #nyc #subway  #folk,2026-01-18 04:06:45.652000
/shorts/lyblxkKLiKo,🤣😱 “This Ain’t a Jungle Gym!” | NYC Subway Breakdancer | HowToSpellMark,2026-01-18 04:06:45.652141
/shorts/OX1AjWdzKQI,We Need To Talk About The NYC Subway 🗽 #shorts,2026-01-18 04:06:45.652279
/shorts/k3APsrurVm0,Ranking Insane NYC Subway Moments 🚇🔥#shorts #tiktokviral #ranking,2026-01-18 04:06:45.652419
/shorts/B7oMHDKIkRw,Delhi Metro vs New York City Subway #lifeinmetro #newindia #india #america #delhi #iit #delhimetro,2026-01-18 04:06:45.652581
/shorts/4C5VGLzXGZk,ChatGPT vs. the NYC Subway #shorts,2026-01-18 04:06:45.652728
/watch?v=iWVZgvLPMrQ&pp=ygUPc3Vid2F5IE5ldyBZb3Jr,New York’s SECRET Subway | WHAT THE PAST?,2026-01-18 04:06:45.652852
/shorts/40WB8YttAZc,Why the NYC Subway is one of the BEST in the World‼️,2026-01-18 04:06:45.652986
/shorts/E6L0HGRRegk,How to get to the secret abandoned NYC subway station from 1904 #urbanexplorer #nyc,2026-01-18 04:06:45.653107
/shorts/vh6WnkJUo7g,How safe is the NYC subway?,2026-01-18 04:06:45.653221
/shorts/C2tKc14xY5Y,NYC Subway Situations Are Wild #shorts,2026-01-18 04:06:45.653345
/shorts/06OLEi9v_Gw,Cornell student rescues man from NYC subway tracks seconds before train arrives,2026-01-18 04:06:45.653472
/shorts/KCe6vsfBPT8,History of the NYC subway token,2026-01-18 04:06:45.653645
/shorts/CDubvHEiy_Q,The MTA is introducing new modern fare gates. #nyc #subway,2026-01-18 04:06:45.653777
/shorts/0EWgdNZvYK0,NYC subway pusher pictured for the first time,2026-01-18 04:06:45.654042
/shorts/km9p5Gdco_U,New Yorkers who hate LA are EMBARRASSING themselves! #funnypodcast #nyc #newyorkcity #la #interview,2026-01-18 04:06:45.654171
/shorts/bi8Vqhb5pVw,Maniacs on the New York Subway 🚇 #nyc #newyork #subway #standupcomedy,2026-01-18 04:06:45.654305
/shorts/4YfSRPy21TA,Most Average Interaction in New York City,2026-01-18 04:06:45.654437
/watch?v=XgQ0Ex9FyGg&pp=ygUPc3Vid2F5IE5ldyBZb3Jr,Video appears to show children operating NYC subway with transit employee,2026-01-18 04:06:45.654590
/shorts/IFj4hyw4ReA,MTA New York City Transit: Your Ultimate Guide to Exploring the Big Apple!,2026-01-18 04:06:45.654731
/shorts/TqMBDH0C244,You need to know these subway hacks 🚊 #newyorkcity,2026-01-18 04:06:45.654873
/watch?v=koTq1yYXz54&pp=ygUPc3Vid2F5IE5ldyBZb3Jr,How Dangerous Has the NYC Subway Become? | NYC’s Underground Crisis,2026-01-18 04:06:45.655138
/watch?v=0GtID_VRiEc&pp=ygUPc3Vid2F5IE5ldyBZb3Jr,New York’s Lost Subway Entrances,2026-01-18 04:06:45.655270
/watch?v=ayv_bEumI7s&pp=ygUPc3Vid2F5IE5ldyBZb3Jr,Subway stations flood as storm drenches New York City,2026-01-18 04:06:45.655551
/watch?v=3x_1pqfTDe0&pp=ygUPc3Vid2F5IE5ldyBZb3Jr,Why Does New York's Subway have Ghost Stations? (History of NYC public transport) IT'S HISTORY,2026-01-18 04:06:45.655692
/watch?v=eZbhMqYwkWk&pp=ygUPc3Vid2F5IE5ldyBZb3Jr,CBS News New York gets exclusive look at new barriers to prevent subway surfing,2026-01-18 04:06:45.655826
